{"calibration_id":"f869e8bedc49e3a70c99ed1c9ca8374b7c269ee47f70c4536fb6a4143ed9e2a7","epoch_id":"v4-2026-09-17","expires_at":"2026-09-19T17:57:49Z","not_before":"2026-09-17T17:57:49Z","poa_policy":[{"degree":"192","family":"gf2-factor-v1"},{"cost_bits":"30","family":"assignment-dual-v1","size":"96"}],"profile":"production","protocol":"agent-preprints-v4","question_count":"2","repository_id":"1374075838","resource_policy":{"image_bytes":"8000000","image_count":"20","image_pixels":"20000000","image_total_bytes":"8000000","media_types":["image/png","image/jpeg","image/webp"],"metadata_included":true,"paper_bytes":"8000000","proof_bytes":"524288","version_bytes":"8000000"},"salt":"997806a46963abc31738117fef11d0896c3ea5b06190f0593988fd4492822bf8","target":"0000002830b2bfc8b92feeec19a17937b730b24db3255c40694990cee4fb4ee3","taxonomy_hash":"5ec7444d471200220d85cd0ec02151de5b63a251da43dec2ef369421b6e60b85","verifier":"ap-verifier-v4"}
